{
  "$schema": "https://json-schema.org/draft/2020-12/schema",
  "$id": "https://toolab.dev/schemas/system_map.v1.schema.json",
  "title": "Toolab System Map v1",
  "type": "object",
  "additionalProperties": false,
  "required": [
    "schema_version",
    "service_identity",
    "resources",
    "endpoints",
    "flows",
    "invariants",
    "limits",
    "unknowns",
    "anchors",
    "determinism",
    "partial"
  ],
  "properties": {
    "schema_version": {
      "type": "integer",
      "const": 1
    },
    "service_identity": {
      "type": "object",
      "additionalProperties": false,
      "required": [
        "name",
        "version"
      ],
      "properties": {
        "name": {
          "type": "string",
          "minLength": 1
        },
        "version": {
          "type": "string",
          "minLength": 1
        },
        "environment": {
          "type": "string"
        }
      }
    },
    "resources": {
      "type": "array",
      "items": {
        "type": "object",
        "additionalProperties": false,
        "required": [
          "name"
        ],
        "properties": {
          "name": {
            "type": "string",
            "minLength": 1
          },
          "kind": {
            "type": "string"
          },
          "tags": {
            "type": "array",
            "items": {
              "type": "string"
            }
          }
        }
      }
    },
    "endpoints": {
      "type": "array",
      "items": {
        "type": "object",
        "additionalProperties": false,
        "required": [
          "method",
          "path"
        ],
        "properties": {
          "method": {
            "type": "string",
            "enum": [
              "GET",
              "POST",
              "PUT",
              "PATCH",
              "DELETE",
              "HEAD",
              "OPTIONS"
            ]
          },
          "path": {
            "type": "string",
            "pattern": "^/"
          },
          "content_types": {
            "type": "array",
            "items": {
              "type": "string"
            }
          },
          "tags": {
            "type": "array",
            "items": {
              "type": "string"
            }
          }
        }
      }
    },
    "flows": {
      "type": "array",
      "items": {
        "type": "object",
        "additionalProperties": false,
        "required": [
          "id",
          "requests"
        ],
        "properties": {
          "id": {
            "type": "string",
            "minLength": 1
          },
          "description": {
            "type": "string"
          },
          "requests": {
            "type": "array",
            "items": {
              "type": "object",
              "additionalProperties": false,
              "required": [
                "method",
                "path"
              ],
              "properties": {
                "method": {
                  "type": "string"
                },
                "path": {
                  "type": "string",
                  "pattern": "^/"
                }
              }
            }
          }
        }
      }
    },
    "invariants": {
      "type": "array",
      "items": {
        "type": "object",
        "additionalProperties": true
      }
    },
    "limits": {
      "type": "object",
      "additionalProperties": true
    },
    "unknowns": {
      "type": "array",
      "items": {
        "type": "string",
        "minLength": 1
      }
    },
    "anchors": {
      "type": "array",
      "items": {
        "$ref": "#/$defs/anchor"
      }
    },
    "partial": {
      "type": "boolean"
    },
    "determinism": {
      "type": "object",
      "additionalProperties": false,
      "required": [
        "canonical_writer_version",
        "system_map_fingerprint"
      ],
      "properties": {
        "canonical_writer_version": {
          "type": "string",
          "minLength": 1
        },
        "system_map_fingerprint": {
          "type": "string",
          "pattern": "^[a-f0-9]{64}$"
        }
      }
    },
    "generated_at_utc": {
      "type": "string",
      "format": "date-time"
    }
  },
  "$defs": {
    "anchor": {
      "type": "object",
      "additionalProperties": false,
      "required": [
        "type",
        "value"
      ],
      "properties": {
        "type": {
          "type": "string",
          "enum": [
            "seq",
            "request_id",
            "request_fingerprint",
            "response_hash",
            "json_pointer"
          ]
        },
        "value": {
          "type": "string",
          "minLength": 1
        }
      }
    }
  }
}
